{
  "version": "1.0",
  "timestamp": "2025-12-31T03:23:00.000Z",
  "repository": {
    "owner": "alengluhic20-oss",
    "name": "contributor_covenant",
    "full_name": "alengluhic20-oss/contributor_covenant"
  },
  "trajectories": [
    {
      "pr_number": 1,
      "title": "Example: Stable PR with good metrics",
      "state": "stable",
      "created_at": "2025-12-30T10:00:00Z",
      "updated_at": "2025-12-31T03:00:00Z",
      "author": "contributor1",
      "points": [
        {
          "timestamp": "2025-12-31T03:00:00Z",
          "score": 0.85,
          "metrics": {
            "code_churn": 0.9,
            "review_engagement": 0.85,
            "conversation_sentiment": 0.8,
            "test_coverage": 0.85,
            "ci_stability": 1.0,
            "merge_conflicts": 1.0
          },
          "velocity": {
            "x": 0,
            "y": 0
          }
        }
      ],
      "current_score": 0.85,
      "trend": "stable"
    },
    {
      "pr_number": 2,
      "title": "Example: Unstable PR needing attention",
      "state": "unstable",
      "created_at": "2025-12-30T12:00:00Z",
      "updated_at": "2025-12-31T02:30:00Z",
      "author": "contributor2",
      "points": [
        {
          "timestamp": "2025-12-31T02:30:00Z",
          "score": 0.55,
          "metrics": {
            "code_churn": 0.6,
            "review_engagement": 0.5,
            "conversation_sentiment": 0.6,
            "test_coverage": 0.5,
            "ci_stability": 0.5,
            "merge_conflicts": 0.7
          },
          "velocity": {
            "x": 0,
            "y": 0
          }
        }
      ],
      "current_score": 0.55,
      "trend": "stable"
    },
    {
      "pr_number": 3,
      "title": "Example: Critical PR requiring immediate attention",
      "state": "critical",
      "created_at": "2025-12-30T14:00:00Z",
      "updated_at": "2025-12-31T01:00:00Z",
      "author": "contributor3",
      "points": [
        {
          "timestamp": "2025-12-31T01:00:00Z",
          "score": 0.25,
          "metrics": {
            "code_churn": 0.3,
            "review_engagement": 0.2,
            "conversation_sentiment": 0.3,
            "test_coverage": 0.2,
            "ci_stability": 0.0,
            "merge_conflicts": 0.5
          },
          "velocity": {
            "x": 0,
            "y": 0
          }
        }
      ],
      "current_score": 0.25,
      "trend": "declining"
    },
    {
      "pr_number": 4,
      "title": "Example: In-flight PR (newly opened)",
      "state": "in_flight",
      "created_at": "2025-12-31T03:00:00Z",
      "updated_at": "2025-12-31T03:00:00Z",
      "author": "contributor4",
      "points": [
        {
          "timestamp": "2025-12-31T03:00:00Z",
          "score": 0,
          "metrics": {
            "code_churn": 0.5,
            "review_engagement": 0.5,
            "conversation_sentiment": 0.5,
            "test_coverage": 0.5,
            "ci_stability": 0.5,
            "merge_conflicts": 0.5
          },
          "velocity": {
            "x": 0,
            "y": 0
          }
        }
      ],
      "current_score": 0,
      "trend": "stable"
    }
  ],
  "summary": {
    "total_prs": 4,
    "stable_count": 1,
    "unstable_count": 1,
    "critical_count": 1,
    "in_flight_count": 1,
    "average_score": 0.4125
  }
}
